media,date,title,article_original,url,kobert,gensim
조선일보,2020-09-17,방탄소년단 빅히트 공모주 다이너마이트 터지나, 내달 56일 코스피 일반 청약 신주 713만주 중 142만주 배정 청약증거금 58조원을 끌어모으며 코스닥 시장에 화려하게 등판한 카카오게임즈 열풍이 잦아들자 이제 투자자들의 관심은 다음 공모주 대어인 빅히트엔터테인먼트빅히트로 옮겨가고 있다. 빅히트는 소속 아이돌 그룹인 BTS방탄소년단가 신곡 다이너마이트로 지난 1일 빌보드 메인 차트인 핫hot 100에서 1위를 차지하자 바로 다음 날인 2일 금융 당국에 증권신고서를 제출하고 본격적으로 코스피 시장 상장 절차에 돌입했다. 빅히트는 오는 24일부터 이틀간 국내외 기관 투자자를 대상으로 수요 예측 조사를 진행한 후 다음 달 56일 개인투자자를 대상으로 일반 청약을 진행할 예정이다.  나도 BTS에 투자해볼까 빅히트는 작곡가이자 프로듀서인 방시혁 대표가 2005년 설립한 연예기획사다. 주요 사업은 소속 가수를 활용한 음반 및 음원 제작유통판매 공연 출판 기념 상품 제작 및 판매등이다. 소속 가수로는 BTS와 투모로우바이투게더TXT 두 팀이 있으며 지난 1년간 플레디스엔터테인먼트와 쏘스뮤직을 인수해 인기 그룹 여자친구 세븐틴 뉴이스트 등을 새로 품었다. 빅히트는 이번 공모를 통해 기존 발행 주식2849만3760주의 25 수준인 713만주를 새로 발행한다. 공모 예정가는 10만5000원13만5000원으로 총 공모 예정액은 7486억9625억원 수준이다. 신주 713만주 가운데 20142만6000주는 우리사주조합에 배정되며 60427만8000주는 기관투자자에게 배정된다. 일반 청약을 통해 개인 투자자들이 살 수 있는 물량은 나머지 20142만6000주다. 빅히트의 예상 시가총액은 공모가를 기준으로 할 때 최대 4조8500억원 수준으로 기존 연예기획사 빅3YG JYP SM의 시총을 모두 합한 금액약 3조4000억원보다 더 많다. 김현용 이베스트투자증권 연구원은 BTS가 미국을 점령한 유일무이한 K팝 그룹이라는 점 아시아 지역 외 공연 비율이 절반에 달하고 누적 음반판매량이 3000만장에 육박한다는 점에서 빅히트에 1등주 프리미엄이 적용된 것으로 보인다고 말했다. 앞서 증시에 상장된 SK바이오팜과 카카오게임즈의 주가가 공모가 대비 몇 배씩 오른 것을 감안하면 빅히트의 시총은 훨씬 더 높아질 것으로 전망된다. 빅히트가 상장할 경우 방시혁 대표뿐 아니라 우리사주를 배정받은 빅히트 직원들 역시 억대의 수익을 얻게 된다. 지난 7월 말 기준 빅히트의 직원 수는 313명으로 평균 4556주씩 빅히트 주식을 보유하게 된다. 빅히트의 공모가가 13만5000원으로 결정되고 상장 첫날 따상상장일 공모가의 2배로 시초가 형성 후 상한가 진입에 성공할 경우35만1000원 1인당 약 9억8000만원의 평가 차익을 얻게 된다.  BTS 의존 비율 88 멤버들 군 입대 문제도 빅히트는 올 상반기 코로나 사태에도 불구하고 연결 기준 매출액 2940억원을 기록하며 국내 기획사 중 가장 좋은 성적을 냈다. 영업이익은 498억원으로 나머지 빅3의 영업이익을 모두 합한 것보다 많다. 특히 빅히트는 다른 기획사와는 달리 전통적인 엔터 산업에 IT기술을 접목해 눈길을 끌고 있다. 팬 커뮤니티 겸 콘텐츠 판매 창구인 스마트폰 애플리케이션앱 위버스와 커머스 앱 위버스샵을 자체적으로 운영하며 수익을 극대화하고 있는 것이다. 빅히트는 이들 플랫폼을 통해 BTS의 온라인 공연과 다큐멘터리 등 콘텐츠는 물론 티셔츠 모자 가방 등 다양한 굿즈기념품를 판매하고 있다. 올 상반기 기준 위버스위버스샵 매출은 총 1127억원으로 전체 매출의 38.3에 달했다 하지만 BTS에 대한 의존도가 과도하다는 점이 빅히트 투자의 위험 요소로 꼽힌다. 지난해 빅히트 매출의 BTS 의존도는 97에 달했다. 빅히트는 올해 다른 기획사들을 인수합병 가수 라인업을 다양화하며 BTS에 대한 의존도를 올 상반기 88까지 낮췄지만 여전히 높은 수치다. BTS 멤버들의 군 입대 문제가 기업 가치 하락으로 이어질 수 있다는 점도 불확실성을 높이고 있다. 2011년 코스닥 시장에 상장한 YG엔터테인먼트 역시 그룹 빅뱅에 대한 의존도가 당시 70에 달해 멤버들의 군 입대 문제가 위험 요소로 꼽혔었다. 빅히트는 증권신고서에서 출생년도가 가장 빠른 멤버 진김석진28은 2021년 말일까지 입영 연기가 가능할 것으로 판단하고 있다고 밝혔다.,https://news.naver.com/main/read.nhn?mode=LSD&mid=sec&sid1=101&oid=023&aid=0003562484,내달 56일 코스피 일반 청약 신주 713만주 중 142만주 배정 청약증거금 58조원을 끌어모으며 코스닥 시장에 화려하게 등판한 카카오게임즈 열풍이 잦아들자 이제 투자자들의 관심은 다음 공모주 대어인 빅히트엔터테인먼트빅히트로 옮겨가고 있다. 신주 713만주 가운데 20142만6000주는 우리사주조합에 배정되며 60427만8000주는 기관투자자에게 배정된다. 빅히트의 예상 시가총액은 공모가를 기준으로 할 때 최대 4조8500억원 수준으로 기존 연예기획사 빅3YG JYP SM의 시총을 모두 합한 금액약 3조4000억원보다 더 많다. 팬 커뮤니티 겸 콘텐츠 판매 창구인 스마트폰 애플리케이션앱 위버스와 커머스 앱 위버스샵을 자체적으로 운영하며 수익을 극대화하고 있는 것이다. 빅히트는 이들 플랫폼을 통해 BTS의 온라인 공연과 다큐멘터리 등 콘텐츠는 물론 티셔츠 모자 가방 등 다양한 굿즈기념품를 판매하고 있다. 2011년 코스닥 시장에 상장한 YG엔터테인먼트 역시 그룹 빅뱅에 대한 의존도가 당시 70에 달해 멤버들의 군 입대 문제가 위험 요소로 꼽혔었다.,"BTS 의존 비율 88 멤버들 군 입대 문제도 빅히트는 올 상반기 코로나 사태에도 불구하고 연결 기준 매출액 2940억원을 기록하며 국내 기획사 중 가장 좋은 성적을 냈다.
올 상반기 기준 위버스위버스샵 매출은 총 1127억원으로 전체 매출의 38.3에 달했다 하지만 BTS에 대한 의존도가 과도하다는 점이 빅히트 투자의 위험 요소로 꼽힌다.
지난해 빅히트 매출의 BTS 의존도는 97에 달했다.
2011년 코스닥 시장에 상장한 YG엔터테인먼트 역시 그룹 빅뱅에 대한 의존도가 당시 70에 달해 멤버들의 군 입대 문제가 위험 요소로 꼽혔었다."
조선일보,2020-09-20,다이너마이트 영어로 부른 BTS   방탄 노래는 들려 따라갈 수 있겠다 영상, 문재인 대통령이 방탄소년단BTS의 노래에 대해 그들의 노래와 춤 모두를 좋아한다고 말했다고 강민석 청와대 대변인이 20일 전했다. BTS의 노래를 실제로 대통령이 좋아하느냐는 질문이 있다는 대변인의 물음에 문 대통령이 이렇게 답했다고 한다. 문 대통령은 BTS의 노래와 춤을 듣고 보다 보면 경지에 오른 청년들 같다며 아이돌 음악은 따라가지 못할 일도 있는데 방탄의 노래는 들린다. 따라갈 수 있겠다고 말했다고 청와대는 밝혔다. BTS가 이번에 빌보드 싱글 차트에서 1위를 차지한 다이너마이트 가사는 모두 영어로 이뤄져 있다. 문 대통령은 그래서 노장청 팬층이 두터운 것 같다고 말했다고 청와대는 밝혔다. 강 대변인은 문 대통령과 BTS는 지난 1월 SNS 메시지를 보내고 감사 댓글을 달면서 소통한 일이 있다고 했다. 강 대변인은 BTS가 19일 청와대에서 열린 청년의날 행사에 참석한 것을 두고 BTS가 청년 대표로 나서 이정표 없는 아티스트의 길을 어떻게 걸어왔는지 오기와 패기 열정과 독기로 예측할 수 없는 길을 나섰다는 메시지를 또래 청년들에게 불어넣어 준 자리라고 평가했다. RM 안녕하세요. 방탄소년단의 리더 RM입니다. 오늘 제1회 청년의 날을 맞아 이 자리에 섰습니다. 초대해 주셔서 진심으로 감사드립니다. 오늘 탄생한 청년의 날이 19년 후 진짜 청년이 되는 날 문득 그날을 한 번 떠올려봅니다. 저희는 오늘 미래의 주인공이 되어있을 그 날의 청년 분들께 메시지를 전해보려고 합니다. 미래의 청년 여러분 잘 지내고 계십니까. 먼저 전 세계 어딘가에서 지금도 도전을 멈추지 않고 용기 있게 삶을 이끌고 계실 대한민국의 모든 청년분들께 응원의 말씀을 전합니다. 지금부터는 스물일곱. 많지 않은 나이지만 롤러코스터와 같은 삶을 살고 있는 어느 일곱 청년의 이야기를 들려드리려고 합니다. 만약 미래의 삶에서 여러 가지 이유로 어려움을 겪고 계시다면 2020년 저희의 이야기가 작은 힘이 되기를 바랍니다. 19일 오전 청와대 녹지원에서 열린 제1회 청년의날 기념식에서 방탄소년단BTS이 청년대표로 참석 청년들을 향한 응원의 메시지를 보내고 있다. 2020.9.19연합뉴스 제이홉 빌보드 1위 가수. 글로벌 슈퍼스타. 저희는 요즘 이런 멋진 표현들을 듣고 있습니다. 하지만 아직도 너무 비현실적인 기분입니다. 사실 시대와 관계없이 아이돌 아티스트라는 직업은 이정표가 없는 길과 같습니다. 음악이란 큰 꿈 하나 메고 떠나지만 내가 걷는 길이 어디를 향하고 있는지 이제부터 오르막인지 내리막인지 한참 가다가 너무 힘들어 멈췄을 때 조금만 더 가면 코앞이 낙원일 지 낭떠러지인지 알 수 없습니다. 저희의 시작은 그랬습니다. 슈가 지금으로부터 7년 전인 데뷔 초 방탄소년단은 오기와 패기 열정과 독기를 무기삼아 감히 예측도 할 수 없는 그런 길을 걷기 시작했습니다. 누구보다 더 성공하고 싶었습니다. 작은 회사에서 데뷔해 많은 어려움 걱정과 맞서가며 어쩌면 무모하고 어쩌면 바보 같을 만큼 앞뒤 돌아보지 않고 열심히 했습니다. 무엇을 어떻게 해야 할 지도 몰랐지만 먼 훗날 다 추억이 될 것이고 지금 힘든 것들은 다 지나갈 것이다 그렇게 절실하게 주문을 외웠던 것 같습니다. 지민 쉬지 않고 달린 것 같은데 분명 우리는 열심히 하고 있는데 참 오랜 시간 동안 제자리였습니다. 서로 예민해지고 다투고 지쳐갈 때쯤 일곱 명이 한 자리에 모였습니다. 저희의 일을 도와주시던 형들이 해 주시던 말씀 너희를 다 이해할 순 없지만 마음이 많이 아프다. 함께 힘을 내 보자. 어쩌면 너무나 평범한 그 한 마디 따뜻한 그 말이 저희에게는 큰 힘이 됐습니다. 어디로 가야할 지 모르는 청년들에게 큰 불빛이 됐습니다. 진 그 시절 스무 살이 갓 지났던 저는 또 다른 현실과 싸워야 했습니다. 데뷔하기 전엔 노력만 하면 뭐든 될 거라 생각했습니다. 하지만 데뷔를 하고 보니 노력보다는 재능이 필요했습니다. 아무리 열심히 해도 친구들을 따라가기 어렵다는 생각이 들었고 저의 자신감 자존감은 크게 아파했습니다. 그러던 어느 순간 문득 깨닫게 됐죠. 진짜 내 모습은 뭘까 지금 내 모습에 더 당당해져도 되지 않을까 자신을 믿어보자. 제이홉 어느 새 방탄소년단이 걷던 길은 조금씩 넓어지고 밝아졌습니다. 팬들의 행복한 얼굴도 보이고 그렇게 마냥 괜찮을 줄 알았습니다. 하지만 생각지도 못한 큰 사랑과 관심만큼 저희의 그림자도 점점 크고 무거워졌습니다. 음악을 사랑했던 우리의 마음까지 짓누르기 시작했습니다. 우리는 누구인가 어떤 사랑을 받고 있는가 치열하게 자신을 다그치며 되물을 수밖에 없었습니다. 뷔 몸과 마음이 너무 지쳤던 것 같습니다. 이젠 내가 어디로 가는 건지 좋아 보이는 이 길도 내가 원치 않는 길은 아니었을지 목표를 잃어버린 듯 했습니다. 행복하지 않았고 공허함이 밀려왔습니다. 감정의 늪에서 빠져나오기 위해 정말 열심히 노력했습니다. 지금 이 순간 스스로에게 솔직해지자. 감정 하나 하나까지 느끼고 쏟아내자. 정국 마치 거짓말처럼 멤버들과 팬들을 생각하며 다시 한번 힘내 보기로 했습니다. 아무것도 없는 길에서 시작했는데 이젠 서로가 서로의 이정표가 된 것 같았습니다. 함께 하는 것이 고맙고 서로에게 도움이 되고 싶다는 마음이 우리의 할 일이 무엇인지 자연스럽게 알게 해줬습니다. 혼자 걸었다면 이렇게 멀리 오지도 못했을 것입니다. 즐겁게 춤추며 달려가지도 못했을 것입니다. RM 2018년 무렵 과분한 성공을 얻고 일곱 멤버가 모두 방황하던 때가 생각납니다. 걷고 있는 길에 꽃밭이 펼쳐지고 탐스런 열매가 떨어져도 저희는 그 길이 늘 그럴 것이다 믿지 못합니다. 언제 다시 내리막이 시작되고 또 폭우가 쏟아질지 모르기 때문이죠. 그런 불안과 우울의 끝에서 저희 일곱은 다시 소년이 된 듯 서로에게 꿈과 믿음을 불어넣기 시작했습니다. 그리고 2020년 8월이 됐습니다. 빌보드 1위. 그리고 또 한 번 빌보드 1위. 우리가 다시 일어섰을 때 주신 이 상들 우리 일곱 명 모두 눈물을 흘리며 감사했습니다. 하지만 더욱 감사한 건 지난 십 년 동안 포기와 낙오의 순간에 서로 단단히 붙잡고 의지가 되어 준 우리 멤버들과 팬들입니다. 진 미래의 청년 여러분 미래가 되어 우리가 서로 청년과 어른으로 마주하게 되어도 이쪽이 맞는 길이다. 방법은 이게 좋다. 이런 삶이 훌륭하다. 이것이 정답이다 말하지 않겠습니다. 대한민국의 청년들은 늘 강하고 대단했습니다. 대신 순간의 행복과 불행이 인생 전체를 좌우하지 않도록 2020년의 방탄소년단이 해낸 것처럼 항상 스스로 일어설 수 있게 지켜드리겠습니다. 여러분이 함께 돕고 의지하며 갈 수 있게 격려해드리겠습니다. 어제의 청년들처럼 오늘의 청년들처럼 지금까지 해왔던 것처럼 멈추지 않고 계속 씩씩하게 걸어가시길 바랍니다. 여러분의 훌륭한 생각으로 세상을 변화시키고 그보다 더 미래의 청년을 위해 앞장서 시대의 불빛이 되어주기를 바랍니다. 방탄소년단이 대한민국의 모든 청년 분들을 응원하겠습니다.,https://news.naver.com/main/read.nhn?mode=LSD&mid=sec&sid1=100&oid=023&aid=0003563200,문재인 대통령이 방탄소년단BTS의 노래에 대해 그들의 노래와 춤 모두를 좋아한다고 말했다고 강민석 청와대 대변인이 20일 전했다. 오늘 탄생한 청년의 날이 19년 후 진짜 청년이 되는 날 문득 그날을 한 번 떠올려봅니다. 많지 않은 나이지만 롤러코스터와 같은 삶을 살고 있는 어느 일곱 청년의 이야기를 들려드리려고 합니다. 지민 쉬지 않고 달린 것 같은데 분명 우리는 열심히 하고 있는데 참 오랜 시간 동안 제자리였습니다. 저희의 일을 도와주시던 형들이 해 주시던 말씀 너희를 다 이해할 순 없지만 마음이 많이 아프다. 아무리 열심히 해도 친구들을 따라가기 어렵다는 생각이 들었고 저의 자신감 자존감은 크게 아파했습니다. 함께 하는 것이 고맙고 서로에게 도움이 되고 싶다는 마음이 우리의 할 일이 무엇인지 자연스럽게 알게 해줬습니다. 진 미래의 청년 여러분 미래가 되어 우리가 서로 청년과 어른으로 마주하게 되어도 이쪽이 맞는 길이다.,"강 대변인은 BTS가 19일 청와대에서 열린 청년의날 행사에 참석한 것을 두고 BTS가 청년 대표로 나서 이정표 없는 아티스트의 길을 어떻게 걸어왔는지 오기와 패기 열정과 독기로 예측할 수 없는 길을 나섰다는 메시지를 또래 청년들에게 불어넣어 준 자리라고 평가했다.
저희는 오늘 미래의 주인공이 되어있을 그 날의 청년 분들께 메시지를 전해보려고 합니다.
만약 미래의 삶에서 여러 가지 이유로 어려움을 겪고 계시다면 2020년 저희의 이야기가 작은 힘이 되기를 바랍니다."
중앙일보,2020-10-07,아미도 냅두라는데BTS 병역특례 2년만에 다시 띄우는 ,   BTS를 병역특례 해주자는 입장이 아니다. 순수예술인은 특례대상인데 대중예술인은 아닌 것에 대한 형평성 문제 사례로 제기한 것이다2018년 안민석 문체위원장 인터뷰   연 6조원 경제효과가 있는 BTS 병역특례를 진지하게 논의해야 한다. 모두가 반드시 총을 들어야 하는 건 아니다.5일 노웅래 더불어민주당 최고위원  BTS 병역문제가 재점화 됐다 . 이번엔 팬들이 아닌 집권 여당이 불을 붙였다. 전날 민주당 최고위원회의에서 이 문제를 공론화한 노웅래 의원은 6일 라디오에서 BTS에 대해 병역특례를 주는 것을 공론화해봐야 한다. 대체 복무를 하며 국위선양을 할 수 있도록 다른 방식으로 복무하도록 해야 한다고 다시 말했다. 그러면서  손흥민 선수도 맹활약하고 있다. 손 선수도 병역특례 조항에 들어가 있다 초선 의원도 가세했다. 병역특례 대신 입영을 30세까지 연기하는 내용의 병역법 개정안을 발의한 같은 당 전용기 의원은 이날 라디오에서  47년 된 병역법 개정이 필요하다며 20대만 꽃 피울 수 있는 새 직업군이 생기는데 현 병역법으로 대응할 수 없다  BTS 병역특례 지금 다시 논의하는 이유는  BTS 병역 문제가 처음 화두로 떠오른 건 2018년 자카르타 아시안게임 때였다. 당시 야구대표팀은 실력이 부족한 몇몇 선수가 병역 특례를 위해 선발됐다는 논란에 휩싸이면서 금메달을 목에 걸고도 비판을 받았다. 운동선수들에게 과도한 병역 특혜가 주어진다는 비판과 함께 대중의 시선은 당시 빌보드200 첫 1위를 달성했던 BTS에도 쏠렸다. 국위선양하는 BTS는 왜 군대 가야 하나는 주장도 제기됐지만 법 개정까지 이어지진 못했다. 이번에 재차 화제가 된 것 역시 지난 8월 말 BTS의 빌보드 싱글차트 1위와 무관치 않다. 문 대통령은 당시 축하 글을 SNS에 올렸고 지난달 19일 청와대에서 열린 청년의날 행사에 BTS를 초청했다. 당시 청와대는   문 대통령은 BTS의 팬 이라며 노래와 춤을 모두 좋아한다고 전했다. 6일 마감된 BTS 소속사  빅히트엔터테인먼트 공모주 청약이 606대1의 높은 경쟁률을 기록한 점도 관심이 커진 이유다. 노웅래 의원은 이날 라디오에서  시의성이 있어 문제 제기를 다시 해야겠다고 생각했다 고 말했다. 국민적 관심이 커진 지금이 논의하기에 적절한 시점이라는 취지였다.  이낙연 정치권 마음대로 번지지 않았으면 여권이 논의에 나서면서 병역법 개정 여부도 관심이 쏠린다. 현재 병역법에선 전문연구 산업기능예술체육요원을 대체복무 대상으로 규정하고 있지만 대중문화 예술인은 포함되지 않는다. 2019년 병역 대체복무제도 개선방안을 발표한 국방부는  대중예술에는 콩쿠르 같은 기준이 없고 대중음악 분야만 대체복무 혜택을 부여할 경우 영화드라마 등과의 형평성 논란이 벌어질 수 있다 당 지도부는 신중한 모드다. 이낙연 민주당 대표는 이날 국회에서 열린 문화예술계 긴급현안 간담회에서   국민께서 어떻게 받아들이실지 또 본인들이 그것을 굳이 원하시지 않는데 정치권에서 먼저 말을 꺼내는 건 어떨까 싶은 조심스러운 생각 이라고 했다. 그러면서   그런 논의가 정치권 마음대로 번져가지 않았으면 한다 국회 소관 상임위는 문화체육관광위다. 도종환 문체위원장 측 관계자는 위원장은 병역을 연기하는 데에는 동의하지만 병역특례까지는 충분한 논의가 필요하다는 입장이라고 말했다. 김종철 정의당 대표 후보는 지난 5일 BTS 병역 특례 문제에 대해 아미BTS 팬클럽로서 반대한다며 다른 청년들과의 형평성 문제가 크게 제기돼 불필요한 논란에 휩싸일 수 있다고 말했다. 최대 변수는 20대 여론이라는 평가다. 병역 특례는 인화성이 높은 탓에 자칫하면 역풍이 불 수 있어서다. 24세 최연소 민주당 지도부인 박성민 최고위원은 이날 라디오에서  본인들이 적극적으로 병역을 성실하게 하겠다고 밝힌 상황 속에서는 구태여 정치권에서 부담을 주는 게 맞나라는 생각을 한다 애매모호한 기준에 맞춰 병역특례 범위를 늘려가는게 형평성에 부합하지 않다는 주장도 나온다. 신종우 한국국방안보포럼 사무국장은 라디오에서 미술 국제대회 1위 때 특례를 받을 수 있는 순수예술의 기준범위 문제를 언급하며 이런 문제를 연구해서 제도화할 정도로 법안을 만드는게 쉽지 않다. 현재 병역자원이 많이 부족해 대체복무인원도 감축하는 추세이기 때문에 빌보드 성적만으로 대체복무를 해야한다는 주장은 맞지 않다고 말했다.,https://news.naver.com/main/read.nhn?mode=LSD&mid=sec&sid1=100&oid=025&aid=0003041163,순수예술인은 특례대상인데 대중예술인은 아닌 것에 대한 형평성 문제 사례로 제기한 것이다2018년 안민석 문체위원장 인터뷰   연 6조원 경제효과가 있는 BTS 병역특례를 진지하게 논의해야 한다. 노웅래 의원은 이날 라디오에서  시의성이 있어 문제 제기를 다시 해야겠다고 생각했다 고 말했다. 이낙연 정치권 마음대로 번지지 않았으면 여권이 논의에 나서면서 병역법 개정 여부도 관심이 쏠린다. 24세 최연소 민주당 지도부인 박성민 최고위원은 이날 라디오에서  본인들이 적극적으로 병역을 성실하게 하겠다고 밝힌 상황 속에서는 구태여 정치권에서 부담을 주는 게 맞나라는 생각을 한다 애매모호한 기준에 맞춰 병역특례 범위를 늘려가는게 형평성에 부합하지 않다는 주장도 나온다. 현재 병역자원이 많이 부족해 대체복무인원도 감축하는 추세이기 때문에 빌보드 성적만으로 대체복무를 해야한다는 주장은 맞지 않다고 말했다.,"전날 민주당 최고위원회의에서 이 문제를 공론화한 노웅래 의원은 6일 라디오에서 BTS에 대해 병역특례를 주는 것을 공론화해봐야 한다.
노웅래 의원은 이날 라디오에서  시의성이 있어 문제 제기를 다시 해야겠다고 생각했다 고 말했다.
김종철 정의당 대표 후보는 지난 5일 BTS 병역 특례 문제에 대해 아미BTS 팬클럽로서 반대한다며 다른 청년들과의 형평성 문제가 크게 제기돼 불필요한 논란에 휩싸일 수 있다고 말했다."
